{
  "checkName": "example-resource",
  "resourceIdentifier": {
    "deviceCertificateId": "id-abc123",
    "caCertificateId": "id-abc123",
    "cognitoIdentityPoolId": "id-abc123",
    "clientId": "id-abc123",
    "policyVersionIdentifier": "id-abc123",
    "account": "example-value",
    "iamRoleArn": "arn:aws:iot:us-east-1:123456789012:thing/example",
    "roleAliasArn": "arn:aws:iot:us-east-1:123456789012:thing/example",
    "issuerCertificateIdentifier": "id-abc123",
    "deviceCertificateArn": "arn:aws:iot:us-east-1:123456789012:thing/example"
  },
  "expirationDate": "example-value",
  "suppressIndefinitely": "example-value",
  "description": "example-value"
}